id,task_type,block_id,question,cot_steps,answer
locate_001,explain,locate,‘오브젝트 위치로 이동하기’ 블록은 어떤 역할을 하나요?,대상 오브젝트 선택 → 그 오브젝트 좌표 확인 → 현재 캐릭터 위치 이동,잘 물어봤어요! 😀 이 블록은 선택한 오브젝트가 있는 자리로 캐릭터를 바로 이동시켜요. 예를 들어 “공” 오브젝트 위치로 이동하기를 쓰면 캐릭터가 공이 있는 자리로 순간 이동해요.
locate_002,explain,locate,이 블록이 없으면 어떤 문제가 생길까요?,다른 오브젝트와의 정확한 위치 동기화 불가,"좋은 질문이에요! 👀 이 블록이 없으면 두 캐릭터가 같은 위치에 서게 하거나, 자동으로 따라가게 만들기가 어려워요."
locate_003,explain,locate,실생활에서 이 블록은 무엇과 비슷할까요?,"친구를 따라가기, 길 안내 서비스",멋진 생각이에요 🙌 이 블록은 친구가 있는 곳으로 바로 달려가는 것과 같아요. 또는 내비게이션에서 목적지 좌표로 바로 이동하는 것과도 비슷하죠 🚗.
locate_004,explain,locate,이 블록으로 어떤 프로젝트를 만들 수 있을까요?,"따라가기 게임, 순간 이동 효과","좋아요! 👍 이 블록을 쓰면 주인공이 적 캐릭터를 따라가거나, 순간이동 마법 같은 효과를 만들 수 있어요 🎮."
locate_005,explain,locate,이 블록을 다른 블록과 합치면 어떤 효과가 있나요?,이동 + 조건/이벤트 → 다양한 상호작용,대단해요! 👏 조건 블록과 합치면 “만약 아이템을 먹으면 아이템 위치로 이동하기” 같은 규칙을 만들 수 있어요. 이벤트와 합치면 캐릭터가 자연스럽게 서로 상호작용하게 만들 수 있죠 ✨.