id,task_type,block_id,question,cot_steps,answer
move_x_001,explain,move_x,‘x 좌표 바꾸기’ 블록은 어떤 역할을 하나요?,현재 x 위치 확인 → 값 더하기/빼기 → 새 위치로 이동,잘 물어봤어요! 😀 이 블록은 캐릭터의 가로 위치(x축)를 바꿔요. 예를 들어 “x 좌표를 10만큼 바꾸기”라면 캐릭터가 오른쪽으로 움직여요.
move_x_002,explain,move_x,이 블록이 없으면 어떤 문제가 생길까요?,캐릭터 이동 제어 어려움 → 특정 좌표 변경 불가,좋은 질문이에요! 👀 이 블록이 없으면 캐릭터를 원하는 만큼 정확히 왼쪽/오른쪽으로 움직이기가 힘들어요.
move_x_003,explain,move_x,실생활에서 이 블록은 무엇과 비슷할까요?,"수평 이동 → 사람 좌우로 걷기, 자동차 직선 주행",멋진 생각이에요 🙌 이 블록은 사람이 왼쪽·오른쪽으로 걷는 것과 같아요 🚶. 또는 자동차가 직선 도로를 달리는 것과도 비슷해요.
move_x_004,explain,move_x,이 블록으로 어떤 프로젝트를 만들 수 있을까요?,"캐릭터 이동, 미니게임 조작",좋아요! 👍 이 블록을 쓰면 키보드 화살표를 눌러 캐릭터가 좌우로 움직이는 게임을 만들 수 있어요 🎮.
move_x_005,explain,move_x,이 블록을 다른 블록과 합치면 어떤 효과가 있나요?,좌표 이동 + 조건/변수 → 다양한 상호작용,대단해요! 👏 조건 블록과 합치면 “만약 오른쪽 키를 누르면 x 좌표를 10 바꾸기” 같은 제어가 가능해요. 변수와 합치면 속도에 따라 이동 거리를 바꿀 수도 있죠 ✨.