id,task_type,block_id,question,cot_steps,answer
when_object_click_001,explain,when_object_click,‘오브젝트를 클릭했을 때’ 블록은 어떤 역할을 하나요?,특정 오브젝트를 클릭 → 이벤트 발생 → 해당 오브젝트가 동작 실행,"잘 물어봤어요! 😀 이 블록은 무대 전체가 아니라, 특정 오브젝트를 클릭했을 때만 반응하게 해줘요. 예를 들어 고양이를 클릭하면 “야옹!” 하고 소리 나게 할 수 있어요. 정말 멋지죠 👏"
when_object_click_002,explain,when_object_click,이 블록이 없으면 오브젝트를 눌러도 왜 반응하지 않을까요?,오브젝트 클릭 이벤트 정의가 없음 → 클릭 무시됨,좋은 질문이에요! 👀 이 블록이 없으면 프로그램은 “어떤 오브젝트가 클릭되었는지” 알 수 없어요. 그래서 클릭해도 캐릭터가 반응하지 않죠. 이 블록을 넣으면 원하는 오브젝트만 반응하게 할 수 있어요 👍
when_object_click_003,explain,when_object_click,실생활에서 이 블록을 무엇에 비유할 수 있을까요?,"특정 대상 눌렀을 때만 반응 → 버튼, 아이콘 비유","멋진 생각이에요 🙌 이 블록은 휴대폰 화면 속 앱 아이콘과 비슷해요. 📱 앱 아이콘을 눌러야 실행되듯, 여기서도 지정된 오브젝트를 클릭해야 캐릭터가 움직여요."
when_object_click_004,explain,when_object_click,이 블록을 활용해서 어떤 재미있는 프로젝트를 만들 수 있을까요?,"클릭 → 반응 → 퀴즈, 숨은 그림 찾기 등 게임 활용","좋아요! 👍 이 블록으로 퀴즈 게임을 만들 수 있어요. 정답 오브젝트를 클릭하면 점수가 올라가고, 틀리면 “다시 해보자!”라는 메시지가 나오게 할 수 있죠. 정말 창의적이에요 👏"
when_object_click_005,explain,when_object_click,이 블록을 다른 블록과 합치면 어떤 걸 할 수 있을까요?,"오브젝트 클릭 이벤트 → 소리, 움직임, 변수와 결합 → 인터랙션 강화","대단해요! 👏 이 블록을 소리 블록과 합치면 클릭할 때 소리를 낼 수 있고, 움직임 블록과 합치면 오브젝트가 이동해요. 점수 변수를 더하면 “클릭 게임”을 만들 수도 있어요 🎮"