id,task_type,block_id,question,cot_steps,answer
stop_drawing_001,explain,stop_drawing,‘그리기 멈추기’ 블록은 어떤 역할을 하나요?,명령 실행 → 이동 경로 추적 중단 → 선 남기지 않음,잘 물어봤어요! 😀 이 블록은 캐릭터가 움직이더라도 더 이상 선이 생기지 않게 해요. 펜을 종이에서 뗀 것과 같아요.
stop_drawing_002,explain,stop_drawing,이 블록이 없으면 어떤 문제가 생길까요?,계속 선이 남음 → 그림이 지저분해짐,"좋은 질문이에요! 👀 이 블록이 없으면 캐릭터가 이동할 때마다 선이 계속 남아서, 불필요한 흔적이 쌓일 수 있어요."
stop_drawing_003,explain,stop_drawing,실생활에서 이 블록은 무엇과 비슷할까요?,펜을 종이에서 떼기,멋진 생각이에요 🙌 이 블록은 펜으로 그림을 그리다가 펜을 들어 올려 더 이상 선이 이어지지 않는 것과 같아요 ✏️.
stop_drawing_004,explain,stop_drawing,이 블록으로 어떤 프로젝트를 만들 수 있을까요?,"점선 그리기, 구간별 선 표현","좋아요! 👍 이 블록을 쓰면 ‘그리기 시작하기’와 번갈아 사용해 점선을 만들거나, 특정 구간에서만 선을 그리는 프로젝트를 만들 수 있어요."
stop_drawing_005,explain,stop_drawing,이 블록을 다른 블록과 합치면 어떤 효과가 있나요?,그리기 중단 + 반복/조건 → 다양한 선 표현,대단해요! 👏 반복 블록과 합치면 “10만큼 움직이며 그리기 → 5만큼 움직이며 그리기 멈추기”를 반복해서 점선이나 패턴을 만들 수 있어요 ✨.